"Twitter: 3 Reasons Why I Am Bullish - Twitter, Inc. (NYSE:TWTR) | Seeking Alpha","Twitter, Inc. (TWTR)",0,0,"http://seekingalpha.com/article/2297955-twitter-3-reasons-why-i-am-bullish?source=feed",2014-07-03 16:00:13.884053
"Starbucks: International Sales To Fuel Growth - Starbucks Corporation (NASDAQ:SBUX) | Seeking Alpha","Starbucks Corporation (SBUX)",0,0,"http://seekingalpha.com/article/2297945-starbucks-international-sales-to-fuel-growth?source=feed",2014-07-03 16:00:16.519125
"Facebook: Its Viral Spread Is About To Reach The Rest Of The Internet - Facebook (NASDAQ:FB) | Seeking Alpha","Facebook (FB)",0,0,"http://seekingalpha.com/article/2297915-facebook-its-viral-spread-is-about-to-reach-the-rest-of-the-internet?source=feed",2014-07-03 16:00:19.441676
"General Electric: Helping Clean Up The Canadian Oil Sands - General Electric Company (NYSE:GE) | Seeking Alpha","General Electric Company (GE)",0,1,"http://seekingalpha.com/article/2313795-general-electric-helping-clean-up-the-canadian-oil-sands?source=feed",2014-07-15 00:02:20.287645
"Why Westport Innovations Is Set To Soar Higher - Westport Innovations Inc (NASDAQ:WPRT) | Seeking Alpha","Westport Innovations Inc (WPRT)",0,0,"http://seekingalpha.com/article/2313775-why-westport-innovations-is-set-to-soar-higher?source=feed",2014-07-15 00:02:20.879269
"Is Bristol-Myers Squibb Overvalued? - Bristol-Myers Squibb Company (NYSE:BMY) | Seeking Alpha","Bristol-Myers Squibb Company (BMY)",0,0,"http://seekingalpha.com/article/2313745-is-bristol-myers-squibb-overvalued?source=feed",2014-07-15 00:02:21.559582
"Finding The New Microsoft In The Nadella Memo - Microsoft Corporation (NASDAQ:MSFT) | Seeking Alpha","Microsoft Corporation (MSFT)",0,0,"http://seekingalpha.com/article/2313735-finding-the-new-microsoft-in-the-nadella-memo?source=feed",2014-07-15 00:02:22.045021
"Why You Should Dump Cirrus Logic And Buy Maxim - Maxim Integrated Products, Inc. (NASDAQ:MXIM) | Seeking Alpha","Maxim Integrated Products, Inc. (MXIM)",0,0,"http://seekingalpha.com/article/2313695-why-you-should-dump-cirrus-logic-and-buy-maxim?source=feed",2014-07-15 00:02:23.307681
"Apple Is Going To Give Corning The BlackBerry Treatment - Apple Inc. (NASDAQ:AAPL) | Seeking Alpha","Apple Inc. (AAPL)",0,0,"http://seekingalpha.com/article/2313685-apple-is-going-to-give-corning-the-blackberry-treatment?source=feed",2014-07-15 00:02:23.710305
"Time To Buy Target's Turnaround - Target Corporation (NYSE:TGT) | Seeking Alpha","Target Corporation (TGT)",0,0,"http://seekingalpha.com/article/2313675-time-to-buy-targets-turnaround?source=feed",2014-07-15 00:02:24.066434
"Facebook: Firing On All Cylinders; A Deep Product By Product Dive Into This Social Media Giant - Facebook (NASDAQ:FB) | Seeking Alpha","Facebook (FB)",0,0,"http://seekingalpha.com/article/2313615-facebook-firing-on-all-cylinders-a-deep-product-by-product-dive-into-this-social-media-giant?source=feed",2014-07-15 00:02:24.511257
"Newcastle Investment: Is Reward Enough To Justify Weak Financials? - Newcastle Investment Corp. (NYSE:NCT) | Seeking Alpha","Newcastle Investment Corp. (NCT)",0,0,"http://seekingalpha.com/article/2313605-newcastle-investment-is-reward-enough-to-justify-weak-financials?source=feed",2014-07-15 00:02:25.074121
"The Road To A $100 Billion Market Capitalization For Starbucks - Starbucks Corporation (NASDAQ:SBUX) | Seeking Alpha","Starbucks Corporation (SBUX)",0,0,"http://seekingalpha.com/article/2313575-the-road-to-a-100-billion-market-capitalization-for-starbucks?source=feed",2014-07-15 00:02:27.152964
"All-Clear Sounding On Citigroup - Citigroup Inc. (NYSE:C) | Seeking Alpha","Citigroup Inc. (C)",0,0,"http://seekingalpha.com/article/2313555-all-clear-sounding-on-citigroup?source=feed",2014-07-15 00:02:27.976760
"Fox Gives Box Office A Bump With Successful Debut Of 'Dawn Of The Planet Of The Apes' - Twenty-First Century Fox, Inc. (NASDAQ:FOXA) | Seeking Alpha","Twenty-First Century Fox, Inc. (FOXA)",0,0,"http://seekingalpha.com/article/2313525-fox-gives-box-office-a-bump-with-successful-debut-of-dawn-of-the-planet-of-the-apes?source=feed",2014-07-15 00:02:28.515692
"Pan-ning For Midway Gold - Midway Gold Corp (NYSEMKT:MDW) | Seeking Alpha","Midway Gold Corp (MDW)",0,0,"http://seekingalpha.com/article/2313475-pan-ning-for-midway-gold?source=feed",2014-07-15 00:02:29.117899
"Long Or Short: Inogen Oxygen Therapy - Inogen, Inc (NASDAQ:INGN) | Seeking Alpha","Inogen, Inc (INGN)",0,0,"http://seekingalpha.com/article/2313445-long-or-short-inogen-oxygen-therapy?source=feed",2014-07-15 00:02:30.128755
"Why Ziopharm Looks Worth Adding To Your Biotechnology Portfolio Pipeline - ZIOPHARM Oncology, Inc. (NASDAQ:ZIOP) | Seeking Alpha","ZIOPHARM Oncology, Inc. (ZIOP)",0,1,"http://seekingalpha.com/article/2313425-why-ziopharm-looks-worth-adding-to-your-biotechnology-portfolio-pipeline?source=feed",2014-07-15 00:02:30.687410
"iKang To Ride The Wave Of Market Reform - iKang Healthcare Group, Inc. (NASDAQ:KANG) | Seeking Alpha","iKang Healthcare Group, Inc. (KANG)",0,1,"http://seekingalpha.com/article/2313385-ikang-to-ride-the-wave-of-market-reform?source=feed",2014-07-15 00:02:31.233953
"Update: Noble Corp. Announces Fleet Report And Timing Of Paragon Offshore Spin-Off - Noble Corporation plc (NYSE:NE) | Seeking Alpha","Noble Corporation plc (NE)",0,0,"http://seekingalpha.com/article/2313345-update-noble-corp-announces-fleet-report-and-timing-of-paragon-offshore-spin-off?source=feed",2014-07-15 00:02:31.775394
"BlackBerry: 3 Keys To Unlock $20 Before 2015 - BlackBerry Ltd. (NASDAQ:BBRY) | Seeking Alpha","BlackBerry Ltd. (BBRY)",0,0,"http://seekingalpha.com/article/2313165-blackberry-3-keys-to-unlock-20-before-2015?source=feed",2014-07-15 00:02:34.255309
"Ross Stores: Undervalued Despite Strong Growth - Ross Stores, Inc. (NASDAQ:ROST) | Seeking Alpha","Ross Stores, Inc. (ROST)",1,1,"http://seekingalpha.com/article/2314865-ross-stores-undervalued-despite-strong-growth?source=feed",2014-07-15 18:00:21.305860
"4 Convincing Reasons Why ARM Holdings' Pullback Is A Solid Opportunity - ARM Holdings, plc (NASDAQ:ARMH) | Seeking Alpha","ARM Holdings, plc (ARMH)",0,0,"http://seekingalpha.com/article/2314855-4-convincing-reasons-why-arm-holdings-pullback-is-a-solid-opportunity?source=feed",2014-07-15 18:00:22.053913
"GreenHunter Resources Could Rise 150% - GreenHunter Resources, Inc. (NYSEMKT:GRH) | Seeking Alpha","GreenHunter Resources, Inc. (GRH)",1,0,"http://seekingalpha.com/article/2311465-greenhunter-resources-could-rise-150-percent?source=feed",2014-07-15 18:00:22.787653
"Loral - To Sell Or Not To Sell Is Not The Question - Loral Space and Communications, Inc. (NASDAQ:LORL) | Seeking Alpha","Loral Space and Communications, Inc. (LORL)",0,1,"http://seekingalpha.com/article/2312345-loral-to-sell-or-not-to-sell-is-not-the-question?source=feed",2014-07-15 18:00:23.660129
"Comcast Is A Capable Competitor - Comcast Corporation (NASDAQ:CMCSA) | Seeking Alpha","Comcast Corporation (CMCSA), CMCSK",0,0,"http://seekingalpha.com/article/2314765-comcast-is-a-capable-competitor?source=feed",2014-07-15 18:00:24.376063
"Apple Hits New 52-Week High - Price Target Raised To $110 - Apple Inc. (NASDAQ:AAPL) | Seeking Alpha","Apple Inc. (AAPL)",0,0,"http://seekingalpha.com/article/2314755-apple-hits-new-52-week-high-price-target-raised-to-110?source=feed",2014-07-15 18:00:25.123403
"Qualcomm: Outlook Is Quite Strong - Qualcomm Inc. (NASDAQ:QCOM) | Seeking Alpha","Qualcomm Inc. (QCOM)",0,0,"http://seekingalpha.com/article/2314715-qualcomm-outlook-is-quite-strong?source=feed",2014-07-15 18:00:25.806343
"Yahoo - Approaching Earnings Release: Bull Vs. Bear - Yahoo! Inc. (NASDAQ:YHOO) | Seeking Alpha","Yahoo! Inc. (YHOO)",0,0,"http://seekingalpha.com/article/2314575-yahoo-approaching-earnings-release-bull-vs-bear?source=feed",2014-07-15 18:00:26.554439
"Whiting Buy Of Kodiak Oil & Gas Should Be Good For Both Companies' Investors - Whiting Petroleum Corporation (NYSE:WLL) | Seeking Alpha","Whiting Petroleum Corporation (WLL), KOG",0,0,"http://seekingalpha.com/article/2314565-whiting-buy-of-kodiak-oil-and-gas-should-be-good-for-both-companies-investors?source=feed",2014-07-15 18:00:27.322533
"Pershing Gold Remains On Track For 2015 Gold Production - Pershing Gold Corporation (OTCMKTS:PGLC) | Seeking Alpha","Pershing Gold Corporation (PGLC)",0,0,"http://seekingalpha.com/article/2314535-pershing-gold-remains-on-track-for-2015-gold-production?source=feed",2014-07-15 18:00:28.154777
"Update: Kodiak Oil & Gas - Price Received In The Whiting Merger Disappoints - Kodiak Oil & Gas Corp (NYSE:KOG) | Seeking Alpha","Kodiak Oil & Gas Corp (KOG)",0,1,"http://seekingalpha.com/article/2312665-update-kodiak-oil-and-gas-price-received-in-the-whiting-merger-disappoints?source=feed",2014-07-15 18:00:28.959459
"AusDrill: More Than Just A Drill Company And Trading At A Discount Compared To Its Book Value - Ausdrill Ltd. (OTCMKTS:AUSDF) | Seeking Alpha","Ausdrill Ltd. (AUSDF)",0,1,"http://seekingalpha.com/article/2312625-ausdrill-more-than-just-a-drill-company-and-trading-at-a-discount-compared-to-its-book-value?source=feed",2014-07-15 18:00:29.820686
"Facebook - A Decent Short-Term Game - Facebook (NASDAQ:FB) | Seeking Alpha","Facebook (FB)",0,0,"http://seekingalpha.com/article/2314475-facebook-a-decent-short-term-game?source=feed",2014-07-15 18:00:30.487817
"It Is The Right Time To Invest In Coach? - Coach, Inc. (NYSE:COH) | Seeking Alpha","Coach, Inc. (COH)",0,1,"http://seekingalpha.com/article/2314425-it-is-the-right-time-to-invest-in-coach?source=feed",2014-07-15 18:00:31.390311
"Yahoo Still Faces A Big Challenge In Mobile - Yahoo! Inc. (NASDAQ:YHOO) | Seeking Alpha","Yahoo! Inc. (YHOO)",0,0,"http://seekingalpha.com/article/2314385-yahoo-still-faces-a-big-challenge-in-mobile?source=feed",2014-07-15 18:00:32.128989
"Tesla: Before And After The Model S - Tesla Motors (NASDAQ:TSLA) | Seeking Alpha","Tesla Motors (TSLA)",0,0,"http://seekingalpha.com/article/2314355-tesla-before-and-after-the-model-s?source=feed",2014-07-15 18:00:32.898888
"Update: The Popular Becomes More Popular: Demand Dynamics Favor Disney - The Walt Disney Company (NYSE:DIS) | Seeking Alpha","The Walt Disney Company (DIS)",0,0,"http://seekingalpha.com/article/2314345-update-the-popular-becomes-more-popular-demand-dynamics-favor-disney?source=feed",2014-07-15 18:00:33.659797
"Starbucks Looks Great Value Compared To This Rival - Starbucks Corporation (NASDAQ:SBUX) | Seeking Alpha","Starbucks Corporation (SBUX)",1,1,"http://seekingalpha.com/article/2314255-starbucks-looks-great-value-compared-to-this-rival?source=feed",2014-07-15 18:00:34.510728
"Golden Minerals Is Not Out Of The Woods Yet, But Shares Remain Attractive For Silver Bulls - Golden Minerals Company (NYSEMKT:AUMN) | Seeking Alpha","Golden Minerals Company (AUMN)",0,0,"http://seekingalpha.com/article/2312395-golden-minerals-is-not-out-of-the-woods-yet-but-shares-remain-attractive-for-silver-bulls?source=feed",2014-07-15 18:00:35.361497
"Update: The Female Health Company Strategy Decision - The Female Health Company (NASDAQ:FHCO) | Seeking Alpha","The Female Health Company (FHCO)",0,0,"http://seekingalpha.com/article/2314235-update-the-female-health-company-strategy-decision?source=feed",2014-07-15 18:00:36.193360
"Zalviso: The Good, The Bad And The Ugly Of The FDA's Complete Response Letter - AcelRx Pharmaceuticals, Inc. (NASDAQ:ACRX) | Seeking Alpha","AcelRx Pharmaceuticals, Inc. (ACRX)",0,0,"http://seekingalpha.com/article/2346275-zalviso-the-good-the-bad-and-the-ugly-of-the-fdas-complete-response-letter?source=feed",2014-07-28 15:25:12.551005
"AutoZone Is 8% Off Its 52-Week High - AutoZone, Inc (NYSE:AZO) | Seeking Alpha","AutoZone, Inc (AZO)",0,0,"http://seekingalpha.com/article/2346195-autozone-is-8-percent-off-its-52-week-high?source=feed",2014-07-28 15:25:13.309862
"Kopin Corporation: Wearable Products With Near Eye Displays, One OEM To Supply Them All? - Kopin Corporation (NASDAQ:KOPN) | Seeking Alpha","Kopin Corporation (KOPN)",1,0,"http://seekingalpha.com/article/2345965-kopin-corporation-wearable-products-with-near-eye-displays-one-oem-to-supply-them-all?source=feed",2014-07-28 15:25:13.863960
"Apple And Me: Why I Finally Bought Some Apple Shares - Apple Inc. (NASDAQ:AAPL) | Seeking Alpha","Apple Inc. (AAPL)",0,0,"http://seekingalpha.com/article/2345925-apple-and-me-why-i-finally-bought-some-apple-shares?source=feed",2014-07-28 15:25:14.459422
"Digital Coupon Campaign: Getting To Know Coupons.com Via Walgreens, Mir Aamir - Coupons.com (NYSE:COUP) | Seeking Alpha","Coupons.com (COUP)",0,0,"http://seekingalpha.com/article/2345855-digital-coupon-campaign-getting-to-know-coupons-com-via-walgreens-mir-aamir?source=feed",2014-07-28 15:25:15.250840
"Why I Bought Amazon.com After It Dropped 10% - Amazon.com, Inc. (NASDAQ:AMZN) | Seeking Alpha","Amazon.com, Inc. (AMZN)",0,1,"http://seekingalpha.com/article/2345825-why-i-bought-amazon-com-after-it-dropped-10-percent?source=feed",2014-07-28 15:25:15.931003
"Lonestar West Positioned For Long-Term Growth - Lonestar West Inc. (OTCMKTS:LSTWF) | Seeking Alpha","Lonestar West Inc. (LSTWF)",0,0,"http://seekingalpha.com/article/2345785-lonestar-west-positioned-for-long-term-growth?source=feed",2014-07-28 15:25:18.842027
"Smart Glasses, Eyewear, Headsets: Kopin Has The IP To Lead - Kopin Corporation (NASDAQ:KOPN) | Seeking Alpha","Kopin Corporation (KOPN)",1,0,"http://seekingalpha.com/article/2345555-smart-glasses-eyewear-headsets-kopin-has-the-ip-to-lead?source=feed",2014-07-28 15:25:20.494039
"Concerned About Equity Valuations? Consider Ford - Ford Motor Company (NYSE:F) | Seeking Alpha","Ford Motor Company (F)",0,1,"http://seekingalpha.com/article/2345535-concerned-about-equity-valuations-consider-ford?source=feed",2014-07-28 15:25:22.475845
"Global Growth Creating Value For Lockheed Martin Shareholders - Lockheed Martin (NYSE:LMT) | Seeking Alpha","Lockheed Martin (LMT)",1,0,"http://seekingalpha.com/article/2345525-global-growth-creating-value-for-lockheed-martin-shareholders?source=feed",2014-07-28 15:25:24.337314
"Google And The Phantom Phone Booth: Investors Should Tune In - Google Inc. (NASDAQ:GOOG) | Seeking Alpha","Google Inc. (GOOG), GOOGL",0,0,"http://seekingalpha.com/article/2345445-google-and-the-phantom-phone-booth-investors-should-tune-in?source=feed",2014-07-28 15:25:26.328878
"Why Visa Is My Largest Holding, With Further Gains Expected - Visa Inc. (NYSE:V) | Seeking Alpha","Visa Inc. (V)",0,0,"http://seekingalpha.com/article/2345185-why-visa-is-my-largest-holding-with-further-gains-expected?source=feed",2014-07-28 15:25:28.300658
"Operating In Obscurity, Microsemi Continues To Execute - Microsemi Corporation (NASDAQ:MSCC) | Seeking Alpha","Microsemi Corporation (MSCC)",0,0,"http://seekingalpha.com/article/2342975-operating-in-obscurity-microsemi-continues-to-execute?source=feed",2014-07-28 15:25:30.281089
"Did BreitBurn Get A Good Deal By Acquiring QR Energy? - BreitBurn Energy Partners, L.P. (NASDAQ:BBEP) | Seeking Alpha","BreitBurn Energy Partners, L.P. (BBEP)",0,0,"http://seekingalpha.com/article/2342815-did-breitburn-get-a-good-deal-by-acquiring-qr-energy?source=feed",2014-07-28 15:25:32.324348
"Flinder's Resources: Deep Value And Low Risk In The Graphite Space - Flinders Resources Ltd (OTCMKTS:FLNXF) | Seeking Alpha","Flinders Resources Ltd (FLNXF)",1,1,"http://seekingalpha.com/article/2342805-flinders-resources-deep-value-and-low-risk-in-the-graphite-space?source=feed",2014-07-28 15:25:34.691255
"Orca Gold: A Well-Funded Gold Explorer With Huge Upside Potential - Orca Gold Inc. (OTCMKTS:CANWF) | Seeking Alpha","Orca Gold Inc. (CANWF)",0,0,"http://seekingalpha.com/article/2342535-orca-gold-a-well-funded-gold-explorer-with-huge-upside-potential?source=feed",2014-07-28 15:25:35.534784
"Why Seagate Is A Buying Opportunity - Seagate Technology (NASDAQ:STX) | Seeking Alpha","Seagate Technology (STX)",1,0,"http://seekingalpha.com/article/2345135-why-seagate-is-a-buying-opportunity?source=feed",2014-07-28 15:25:36.359267
"Tropicana Entertainment: Casino Operator Trading At A Significant Discount To Peers With At Least 30% Upside - Tropicana Entertainment Inc. (OTCMKTS:TPCA) | Seeking Alpha","Tropicana Entertainment Inc. (TPCA)",1,1,"http://seekingalpha.com/article/2341785-tropicana-entertainment-casino-operator-trading-at-a-significant-discount-to-peers-with-at-least-30-percent-upside?source=feed",2014-07-28 15:25:37.300318
"Accounting For Paycom's Accounting Heading Into Earnings - Paycom Software, Inc. (NYSE:PAYC) | Seeking Alpha","Paycom Software, Inc. (PAYC)",0,1,"http://seekingalpha.com/article/2340075-accounting-for-paycoms-accounting-heading-into-earnings?source=feed",2014-07-28 15:25:38.197408
"Comcast: Universal Continues Strong Year Courtesy Of 'Lucy' And Other Small Budget Films - Comcast Corporation (NASDAQ:CMCSA) | Seeking Alpha","Comcast Corporation (CMCSA)",0,0,"http://seekingalpha.com/article/2346435-comcast-universal-continues-strong-year-courtesy-of-lucy-and-other-small-budget-films?source=feed",2014-07-28 16:36:07.272694
"The Mind Of A BlackBerry Long: 'My Heart Bleeds' For Apple/IBM Alliance - BlackBerry Ltd. (NASDAQ:BBRY) | Seeking Alpha","BlackBerry Ltd. (BBRY)",0,0,"http://seekingalpha.com/article/2346415-the-mind-of-a-blackberry-long-my-heart-bleeds-for-apple-ibm-alliance?source=feed",2014-07-28 16:36:08.284199
"Will Windows 9 Be Able To Save Microsoft? - Microsoft Corporation (NASDAQ:MSFT) | Seeking Alpha","Microsoft Corporation (MSFT)",0,0,"http://seekingalpha.com/article/2346345-will-windows-9-be-able-to-save-microsoft?source=feed",2014-07-28 16:36:09.241464
"Freeport Is A Buy After Indonesia Deal - Freeport-McMoRan Copper & Gold Inc. (NYSE:FCX) | Seeking Alpha","Freeport-McMoRan Copper & Gold Inc. (FCX)",1,1,"http://seekingalpha.com/article/2346505-freeport-is-a-buy-after-indonesia-deal?source=feed",2014-07-28 16:58:12.496087
"Air New Zealand: Successful Turnaround Resulting In Stable Performance - Air New Zealand Ltd. (OTCMKTS:ANZFF) | Seeking Alpha","Air New Zealand Ltd. (ANZFF)",0,0,"http://seekingalpha.com/article/2346495-air-new-zealand-successful-turnaround-resulting-in-stable-performance?source=feed",2014-07-28 16:58:13.014349
"Starbucks: Shares Will Reach $90 - Starbucks Corporation (NASDAQ:SBUX) | Seeking Alpha","Starbucks Corporation (SBUX)",0,0,"http://seekingalpha.com/article/2346485-starbucks-shares-will-reach-90?source=feed",2014-07-28 16:58:13.525129
"Sino Gas International Holdings: 5.7% Gross Profit In 1.5 Months - Sino Gas International Holdings, Inc. (OTCMKTS:SGAS) | Seeking Alpha","Sino Gas International Holdings, Inc. (SGAS)",0,0,"http://seekingalpha.com/article/2211303-sino-gas-international-holdings-5_7-percent-gross-profit-in-1_5-months?source=feed",2014-07-28 17:08:04.708982
"A Review Of New Resource Bank, A Profitable 'Story Stock' Trading Below Book Value - New Resource Bank (San Francisco CA) (OTCMKTS:NWBN) | Seeking Alpha","New Resource Bank (San Francisco CA) (NWBN)",0,0,"http://seekingalpha.com/article/2211343-a-review-of-new-resource-bank-a-profitable-story-stock-trading-below-book-value?source=feed",2014-07-28 17:08:07.076582
"Alloy Steel International: 1X EV / Net Income, 62% Of Book Value For Growing Company - Alloy Steel International, Inc. (OTCMKTS:AYSI) | Seeking Alpha","Alloy Steel International, Inc. (AYSI)",0,0,"http://seekingalpha.com/article/2211423-alloy-steel-international-1x-ev-net-income-62-percent-of-book-value-for-growing-company?source=feed",2014-07-28 17:08:09.425975
"Enphase: Strong Story, Strong Growth And Decent Valuation Make For Substantial Upside - Enphase Energy Inc. (NASDAQ:ENPH) | Seeking Alpha","Enphase Energy Inc. (ENPH)",0,0,"http://seekingalpha.com/article/2211503-enphase-strong-story-strong-growth-and-decent-valuation-make-for-substantial-upside?source=feed",2014-07-28 17:08:11.799639
"Bloodied Blinkx Now Has Huge Upside - Blinkx Plc (OTCMKTS:BLNKF) | Seeking Alpha","Blinkx Plc (BLNKF)",0,0,"http://seekingalpha.com/article/2211513-bloodied-blinkx-now-has-huge-upside?source=feed",2014-07-28 17:08:14.288024
"Vermillion Energy: Relentless Focus On Capital Efficiency Will Drive Stock To $85 By Next Summer - Vermilion Energy Inc (NYSE:VET) | Seeking Alpha","Vermilion Energy Inc (VET)",0,0,"http://seekingalpha.com/article/2212073-vermillion-energy-relentless-focus-on-capital-efficiency-will-drive-stock-to-85-by-next-summer?source=feed",2014-07-28 17:08:16.705977
"Bank Of America: Don't Be Fooled By The Negative Noise - Bank of America Corporation (NYSE:BAC) | Seeking Alpha","Bank of America Corporation (BAC)",1,0,"http://seekingalpha.com/article/2212163-bank-of-america-dont-be-fooled-by-the-negative-noise?source=feed",2014-07-28 17:08:18.262561
"America Movil Going Global In A Search For Value - America Movil SA de CV (NYSE:AMX) | Seeking Alpha","America Movil SA de CV (AMX)",0,0,"http://seekingalpha.com/article/2212203-america-movil-going-global-in-a-search-for-value?source=feed",2014-07-28 17:08:19.144991
"Yoga Pants: Why High-Growth Columbia Sportswear Should Be In Your Portfolio - Columbia Sportswear Company (NASDAQ:COLM) | Seeking Alpha","Columbia Sportswear Company (COLM)",0,0,"http://seekingalpha.com/article/2212343-yoga-pants-why-high-growth-columbia-sportswear-should-be-in-your-portfolio?source=feed",2014-07-28 17:08:20.008748
"Revenue Growth: What Has Happened To IBM's Sales Culture? - International Business Machines Corporation (NYSE:IBM) | Seeking Alpha","International Business Machines Corporation (IBM)",0,0,"http://seekingalpha.com/article/2212863-revenue-growth-what-has-happened-to-ibms-sales-culture?source=feed",2014-07-28 17:08:20.945083
"Lake Shore Gold - Sunshine After Rain - Lake Shore Gold Corp (NYSEMKT:LSG) | Seeking Alpha","Lake Shore Gold Corp (LSG)",0,0,"http://seekingalpha.com/article/2213113-lake-shore-gold-sunshine-after-rain?source=feed",2014-07-28 17:08:22.343142
"Alcatel-Lucent: Some Technical Indicators Hint $4.50 Is Near - Alcatel-Lucent (NYSE:ALU) | Seeking Alpha","Alcatel-Lucent (ALU)",0,0,"http://seekingalpha.com/article/2213263-alcatel-lucent-some-technical-indicators-hint-4_50-is-near?source=feed",2014-07-28 17:08:24.068567
"Why Micron's Stock Is Still A Buy Right Now - Micron Technology Inc. (NASDAQ:MU) | Seeking Alpha","Micron Technology Inc. (MU)",1,1,"http://seekingalpha.com/article/2213373-why-microns-stock-is-still-a-buy-right-now?source=feed",2014-07-28 17:08:26.021300
"Ameresco, Inc. Remains In Holding Pattern - Ameresco, Inc. (NYSE:AMRC) | Seeking Alpha","Ameresco, Inc. (AMRC)",0,0,"http://seekingalpha.com/article/2213473-ameresco-inc-remains-in-holding-pattern?source=feed",2014-07-28 17:08:28.105565
"American Eagle Should Consider A Change In Strategy - American Eagle Outfitters, Inc. (NYSE:AEO) | Seeking Alpha","American Eagle Outfitters, Inc. (AEO)",0,0,"http://seekingalpha.com/article/2213533-american-eagle-should-consider-a-change-in-strategy?source=feed",2014-07-28 17:08:30.246105
"The Pair Trade: Long Pepsi, Short Coca-Cola - PepsiCo Inc. (NYSE:PEP) | Seeking Alpha","PepsiCo Inc. (PEP), KO",0,0,"http://seekingalpha.com/article/2213553-the-pair-trade-long-pepsi-short-coca-cola?source=feed",2014-07-28 17:08:32.601063
"Alcatel-Lucent: Great Opportunity To Make Money As The Street Is Still Haunted By Past Disappointments - Alcatel-Lucent (NYSE:ALU) | Seeking Alpha","Alcatel-Lucent (ALU)",0,0,"http://seekingalpha.com/article/2213643-alcatel-lucent-great-opportunity-to-make-money-as-the-street-is-still-haunted-by-past-disappointments?source=feed",2014-07-28 17:08:34.987785
"The $15 Price Target For AMD For 2016 Is Realistic - It's Based On Historical Performance - Advanced Micro Devices, Inc. (NYSE:AMD) | Seeking Alpha","Advanced Micro Devices, Inc. (AMD)",0,0,"http://seekingalpha.com/article/2213653-the-15-price-target-for-amd-for-2016-is-realistic-its-based-on-historical-performance?source=feed",2014-07-28 17:08:37.365109
"Why It Will Be A While Before Whole Foods Is Made Whole - Whole Foods Market, Inc. (NASDAQ:WFM) | Seeking Alpha","Whole Foods Market, Inc. (WFM)",0,0,"http://seekingalpha.com/article/2213673-why-it-will-be-a-while-before-whole-foods-is-made-whole?source=feed",2014-07-28 17:08:39.859699
"Mixi: A Rare Undervalued Mobile Gaming Stock - Mixi, Inc. (OTCMKTS:MIXIF) | Seeking Alpha","Mixi, Inc. (MIXIF)",1,0,"http://seekingalpha.com/article/2213693-mixi-a-rare-undervalued-mobile-gaming-stock?source=feed",2014-07-28 17:08:42.287282
"Zero Hour Is Upon BlackBerry - BlackBerry Ltd. (NASDAQ:BBRY) | Seeking Alpha","BlackBerry Ltd. (BBRY)",0,1,"http://seekingalpha.com/article/2213743-zero-hour-is-upon-blackberry?source=feed",2014-07-28 17:08:44.712020
"Gogo: Excellent Entry Point For Long-Term Opportunistic Investors - Gogo (NASDAQ:GOGO) | Seeking Alpha","Gogo (GOGO)",0,0,"http://seekingalpha.com/article/2213763-gogo-excellent-entry-point-for-long-term-opportunistic-investors?source=feed",2014-07-28 17:08:45.570013
"Advanced Micro Devices Is Well Positioned To Grow - Advanced Micro Devices, Inc. (NYSE:AMD) | Seeking Alpha","Advanced Micro Devices, Inc. (AMD)",0,0,"http://seekingalpha.com/article/2213833-advanced-micro-devices-is-well-positioned-to-grow?source=feed",2014-07-28 17:08:46.490699
"Bank Of America: Ignore The Clueless Research Firms - Bank of America Corporation (NYSE:BAC) | Seeking Alpha","Bank of America Corporation (BAC)",0,0,"http://seekingalpha.com/article/2213853-bank-of-america-ignore-the-clueless-research-firms?source=feed",2014-07-28 17:08:47.346352
"The 'New' Microsoft - Heading To $45 - Microsoft Corporation (NASDAQ:MSFT) | Seeking Alpha","Microsoft Corporation (MSFT)",0,0,"http://seekingalpha.com/article/2213883-the-new-microsoft-heading-to-45?source=feed",2014-07-28 17:08:48.291661
