"Tesla The Disruptor Vs. Oil The Corrupter - Tesla Motors (NASDAQ:TSLA) | Seeking Alpha","Tesla Motors (TSLA)",0,0,"http://seekingalpha.com/article/2276513-tesla-the-disruptor-vs-oil-the-corrupter?source=feed",2014-07-28 17:55:54.126603
"TravelCenters Of America Is Turning Towards Growth And Profits - TravelCenters of America LLC (NYSE:TA) | Seeking Alpha","TravelCenters of America LLC (TA)",0,0,"http://seekingalpha.com/article/2276543-travelcenters-of-america-is-turning-towards-growth-and-profits?source=feed",2014-07-28 17:55:56.228786
"Deep Sea Supply: On Track For Strong Growth And Dividends - Deep Sea Supply Plc. (OTCMKTS:DSSPF) | Seeking Alpha","Deep Sea Supply Plc. (DSSPF)",0,0,"http://seekingalpha.com/article/2276553-deep-sea-supply-on-track-for-strong-growth-and-dividends?source=feed",2014-07-28 17:55:58.505110
"Lundbeck Delivers Some Data-Driven Upside - H. Lundbeck A/S ADR (OTCMKTS:HLUYY) | Seeking Alpha","H. Lundbeck A/S ADR (HLUYY)",0,0,"http://seekingalpha.com/article/2276563-lundbeck-delivers-some-data-driven-upside?source=feed",2014-07-28 17:56:00.748069
"Fear Not The Street: Bank Of America More Than Prepared For Upcoming Fine - Bank of America Corporation (NYSE:BAC) | Seeking Alpha","Bank of America Corporation (BAC)",0,0,"http://seekingalpha.com/article/2276593-fear-not-the-street-bank-of-america-more-than-prepared-for-upcoming-fine?source=feed",2014-07-28 17:56:03.093777
"GT Advanced Technologies: The Iggy Azalea Of Tech Stocks - GT Advanced Technologies, Inc. (NASDAQ:GTAT) | Seeking Alpha","GT Advanced Technologies, Inc. (GTAT)",0,0,"http://seekingalpha.com/article/2276603-gt-advanced-technologies-the-iggy-azalea-of-tech-stocks?source=feed",2014-07-28 17:56:03.938780
"AMD: Digesting And Adding To Digitimes' GPU Article - Advanced Micro Devices, Inc. (NYSE:AMD) | Seeking Alpha","Advanced Micro Devices, Inc. (AMD)",0,1,"http://seekingalpha.com/article/2276613-amd-digesting-and-adding-to-digitimes-gpu-article?source=feed",2014-07-28 17:56:05.042541
"SolarCity Still Overvalued But Moving In Right Direction - SolarCity Corp. (NASDAQ:SCTY) | Seeking Alpha","SolarCity Corp. (SCTY)",0,0,"http://seekingalpha.com/article/2276623-solarcity-still-overvalued-but-moving-in-right-direction?source=feed",2014-07-28 17:56:05.923112
"Epizyme: Undervalued Rare Asset With Outsized Potential - Epizyme (NASDAQ:EPZM) | Seeking Alpha","Epizyme (EPZM)",1,0,"http://seekingalpha.com/article/2276633-epizyme-undervalued-rare-asset-with-outsized-potential?source=feed",2014-07-28 17:56:06.770973
"General Electric: Expect An Improved Offer For Alstom - General Electric Company (NYSE:GE) | Seeking Alpha","General Electric Company (GE)",0,0,"http://seekingalpha.com/article/2276653-general-electric-expect-an-improved-offer-for-alstom?source=feed",2014-07-28 17:56:07.644447
"Second Apple Sapphire Plant Operations Emerges From GT Advanced Technologies' Amended 10-Q - GT Advanced Technologies, Inc. (NASDAQ:GTAT) | Seeking Alpha","GT Advanced Technologies, Inc. (GTAT)",0,0,"http://seekingalpha.com/article/2276673-second-apple-sapphire-plant-operations-emerges-from-gt-advanced-technologies-amended-10-q?source=feed",2014-07-28 17:56:08.516080
"Chicago Bridge & Iron: Why You Should Grasp This Rare Opportunity - Chicago Bridge & Iron Company (NYSE:CBI) | Seeking Alpha","Chicago Bridge & Iron Company (CBI)",0,0,"http://seekingalpha.com/article/2276783-chicago-bridge-and-iron-why-you-should-grasp-this-rare-opportunity?source=feed",2014-07-28 17:56:09.969452
"Opower's Long-Term Goals Come Into Focus - OPOWER, Inc. (NYSE:OPWR) | Seeking Alpha","OPOWER, Inc. (OPWR)",0,0,"http://seekingalpha.com/article/2276833-opowers-long-term-goals-come-into-focus?source=feed",2014-07-28 17:56:11.491078
"BlackBerry: On Track To Financial Stability - BlackBerry Ltd. (NASDAQ:BBRY) | Seeking Alpha","BlackBerry Ltd. (BBRY)",0,0,"http://seekingalpha.com/article/2276903-blackberry-on-track-to-financial-stability?source=feed",2014-07-28 17:56:12.582998
"BlackBerry's Bullish Call Offers Clues To Epic Turnaround - BlackBerry Ltd. (NASDAQ:BBRY) | Seeking Alpha","BlackBerry Ltd. (BBRY)",0,0,"http://seekingalpha.com/article/2276933-blackberrys-bullish-call-offers-clues-to-epic-turnaround?source=feed",2014-07-28 17:56:13.902639
"Rite Aid: Take Advantage Of An Unwarranted Pullback - Rite Aid Corporation (NYSE:RAD) | Seeking Alpha","Rite Aid Corporation (RAD)",0,0,"http://seekingalpha.com/article/2277013-rite-aid-take-advantage-of-an-unwarranted-pullback?source=feed",2014-07-28 17:56:15.696672
"BlackBerry Can Be Bought - BlackBerry Ltd. (NASDAQ:BBRY) | Seeking Alpha","BlackBerry Ltd. (BBRY)",0,0,"http://seekingalpha.com/article/2277023-blackberry-can-be-bought?source=feed",2014-07-28 17:56:17.804947
"Twitter Finally Warms Up To Wall Street - Twitter, Inc. (NYSE:TWTR) | Seeking Alpha","Twitter, Inc. (TWTR)",0,0,"http://seekingalpha.com/article/2277033-twitter-finally-warms-up-to-wall-street?source=feed",2014-07-28 17:56:18.673803
"Netflix: $35 Billion In Revenue Is Attainable By 2024 - Netflix, Inc. (NASDAQ:NFLX) | Seeking Alpha","Netflix, Inc. (NFLX)",0,0,"http://seekingalpha.com/article/2277053-netflix-35-billion-in-revenue-is-attainable-by-2024?source=feed",2014-07-28 17:56:19.579012
"Sprint: $9 Or $14? Pick Your Scenario, Part II - Sprint Corporation (NYSE:S) | Seeking Alpha","Sprint Corporation (S)",0,0,"http://seekingalpha.com/article/2277063-sprint-9-or-14-pick-your-scenario-part-ii?source=feed",2014-07-28 17:56:20.476293
"Merrimack Pharmaceuticals: The Sleeping Giant Of Cancer Care - Merrimack Pharmaceuticals (NASDAQ:MACK) | Seeking Alpha","Merrimack Pharmaceuticals (MACK)",0,0,"http://seekingalpha.com/article/2277083-merrimack-pharmaceuticals-the-sleeping-giant-of-cancer-care?source=feed",2014-07-28 17:56:21.997051
"SodaStream Shares Spike As Investors See Signs Of Sales Being Reported - SodaStream International (NASDAQ:SODA) | Seeking Alpha","SodaStream International (SODA)",0,0,"http://seekingalpha.com/article/2277093-sodastream-shares-spike-as-investors-see-signs-of-sales-being-reported?source=feed",2014-07-28 17:56:23.666496
"Female Health Company: Sustainable Moat Through Education - The Female Health Company (NASDAQ:FHCO) | Seeking Alpha","The Female Health Company (FHCO)",0,0,"http://seekingalpha.com/article/2277123-female-health-company-sustainable-moat-through-education?source=feed",2014-07-28 17:56:25.531695
"Glu Mobile Looks Poised To Enter Real Money Gaming - Glu Mobile Inc. (NASDAQ:GLUU) | Seeking Alpha","Glu Mobile Inc. (GLUU)",0,0,"http://seekingalpha.com/article/2277243-glu-mobile-looks-poised-to-enter-real-money-gaming?source=feed",2014-07-28 17:56:27.574147
"Energy Transfer Partners And Equity Offer Complicated Value - Energy Transfer Partners, L.P. (NYSE:ETP) | Seeking Alpha","Energy Transfer Partners, L.P. (ETP), ETE",0,0,"http://seekingalpha.com/article/2277283-energy-transfer-partners-and-equity-offer-complicated-value?source=feed",2014-07-28 17:56:29.792835
"Dollarama - There Are Still Some Dollars To Squeeze Out - Dollarama, Inc. (OTCMKTS:DLMAF) | Seeking Alpha","Dollarama, Inc. (DLMAF)",0,0,"http://seekingalpha.com/article/2277343-dollarama-there-are-still-some-dollars-to-squeeze-out?source=feed",2014-07-28 17:56:34.096363
"DBS Group Offers A Quality Play On Growth In China And ASEAN - DBS Group Holdings Ltd. ADR (OTCMKTS:DBSDY) | Seeking Alpha","DBS Group Holdings Ltd. ADR (DBSDY)",0,0,"http://seekingalpha.com/article/2277413-dbs-group-offers-a-quality-play-on-growth-in-china-and-asean?source=feed",2014-07-28 17:56:36.412027
"With Google Fit, Google Declares War With Apple In Mobile Healthcare - Google Inc. (NASDAQ:GOOGL) | Seeking Alpha","Google Inc. (GOOGL), GOOG, AAPL",0,0,"http://seekingalpha.com/article/2277433-with-google-fit-google-declares-war-with-apple-in-mobile-healthcare?source=feed",2014-07-28 17:56:38.764037
"The Inflection Point For Stem Cells: An Interview With Advanced Cell Technology's Management - Advanced Cell Technology, Inc. (OTCMKTS:ACTC) | Seeking Alpha","Advanced Cell Technology, Inc. (ACTC)",0,0,"http://seekingalpha.com/article/2277443-the-inflection-point-for-stem-cells-an-interview-with-advanced-cell-technologys-management?source=feed",2014-07-28 17:56:39.623607
"Texas Instruments Expands Its Embedded Portfolio With WiFi Solutions For IoT - Texas Instruments Inc. (NASDAQ:TXN) | Seeking Alpha","Texas Instruments Inc. (TXN)",0,0,"http://seekingalpha.com/article/2277523-texas-instruments-expands-its-embedded-portfolio-with-wifi-solutions-for-iot?source=feed",2014-07-28 17:56:40.528514
"Zacks' Bull Of The Day: Delta Air Lines - Delta Air Lines, Inc. (NYSE:DAL) | Seeking Alpha","Delta Air Lines, Inc. (DAL)",0,0,"http://seekingalpha.com/article/2277573-zacks-bull-of-the-day-delta-air-lines?source=feed",2014-07-28 17:56:41.401139
"Gun Production: As American As Apple Pie - Sturm, Ruger & Company Inc. (NYSE:RGR) | Seeking Alpha","Sturm, Ruger & Company Inc. (RGR), SWHC",1,1,"http://seekingalpha.com/article/2277613-gun-production-as-american-as-apple-pie?source=feed",2014-07-28 17:56:42.857776
"Nokia Looks To Bolster Its HERE Maps Business With Recent Buys - Nokia Corporation (NYSE:NOK) | Seeking Alpha","Nokia Corporation (NOK)",0,1,"http://seekingalpha.com/article/2277673-nokia-looks-to-bolster-its-here-maps-business-with-recent-buys?source=feed",2014-07-28 17:56:44.507464
"BlackBerry: Phenomenal Turnaround In The Making - BlackBerry Ltd. (NASDAQ:BBRY) | Seeking Alpha","BlackBerry Ltd. (BBRY)",0,0,"http://seekingalpha.com/article/2277733-blackberry-phenomenal-turnaround-in-the-making?source=feed",2014-07-28 17:56:46.388644
"Chesapeake's Oil Services Spin-Off Has A Lot Of Upside Potential - Seventy Seven Energy Inc. (NYSE:SSE) | Seeking Alpha","Seventy Seven Energy Inc. (SSE)",0,0,"http://seekingalpha.com/article/2277763-chesapeakes-oil-services-spin-off-has-a-lot-of-upside-potential?source=feed",2014-07-28 17:56:48.349858
"3D Systems: Bottomed Out And Rallying. Here's How To Maximize Gains - 3D Systems Corp. (NYSE:DDD) | Seeking Alpha","3D Systems Corp. (DDD)",0,0,"http://seekingalpha.com/article/2277793-3d-systems-bottomed-out-and-rallying-heres-how-to-maximize-gains?source=feed",2014-07-28 17:56:50.573654
"Tesla Powers Up In The U.K. And China: Future Looks Bright - Tesla Motors (NASDAQ:TSLA) | Seeking Alpha","Tesla Motors (TSLA)",0,0,"http://seekingalpha.com/article/2277803-tesla-powers-up-in-the-u-k-and-china-future-looks-bright?source=feed",2014-07-28 17:56:52.933152
"3 Reasons To Buy Alcatel-Lucent - Alcatel-Lucent (NYSE:ALU) | Seeking Alpha","Alcatel-Lucent (ALU)",0,0,"http://seekingalpha.com/article/2277843-3-reasons-to-buy-alcatel-lucent?source=feed",2014-07-28 17:56:55.302067
"Why Broadcom's Bullish Run Isn't Over Yet - Broadcom Corporation (NASDAQ:BRCM) | Seeking Alpha","Broadcom Corporation (BRCM)",0,0,"http://seekingalpha.com/article/2277853-why-broadcoms-bullish-run-isnt-over-yet?source=feed",2014-07-28 17:56:57.117431
"TE Connectivity: Measurement Specialties Deal Smart By My Measures - TE Connectivity Ltd. (NYSE:TEL) | Seeking Alpha","TE Connectivity Ltd. (TEL)",0,1,"http://seekingalpha.com/article/2277863-te-connectivity-measurement-specialties-deal-smart-by-my-measures?source=feed",2014-07-28 17:56:58.014864
"Plug Power: 5 Reasons Why This 209% Gainer Hasn't Run Out Of Steam Yet - Plug Power, Inc. (NASDAQ:PLUG) | Seeking Alpha","Plug Power, Inc. (PLUG)",0,0,"http://seekingalpha.com/article/2277873-plug-power-5-reasons-why-this-209-percent-gainer-hasnt-run-out-of-steam-yet?source=feed",2014-07-28 17:56:59.007873
"Bank Of America: Why We Are Neutral Despite A Thriving Wealth Business - Bank of America Corporation (NYSE:BAC) | Seeking Alpha","Bank of America Corporation (BAC)",0,0,"http://seekingalpha.com/article/2277893-bank-of-america-why-we-are-neutral-despite-a-thriving-wealth-business?source=feed",2014-07-28 17:56:59.902350
"Arabella Exploration's High-Quality Permian Wolfbone Acreage Position Has 33% Upside By Year-End - Arabella Exploration, Inc. (OTCMKTS:AXPLF) | Seeking Alpha","Arabella Exploration, Inc. (AXPLF)",0,0,"http://seekingalpha.com/article/2277913-arabella-explorations-high-quality-permian-wolfbone-acreage-position-has-33-percent-upside-by-year-end?source=feed",2014-07-28 17:57:00.700269
"Why Cisco's Tail-F Acquisition Could Be Positive For Investors - Cisco Systems, Inc. (NASDAQ:CSCO) | Seeking Alpha","Cisco Systems, Inc. (CSCO)",0,0,"http://seekingalpha.com/article/2277923-why-ciscos-tail-f-acquisition-could-be-positive-for-investors?source=feed",2014-07-28 17:57:02.202165
"As Brazil Has Slowed, Itau Unibanco Has Battened Down The Hatches - Itau Unibanco Holding S.A. (NYSE:ITUB) | Seeking Alpha","Itau Unibanco Holding S.A. (ITUB)",0,0,"http://seekingalpha.com/article/2277933-as-brazil-has-slowed-itau-unibanco-has-battened-down-the-hatches?source=feed",2014-07-28 17:57:03.856713
"Why This Physician Is Bullish On Celgene - Celgene Corporation (NASDAQ:CELG) | Seeking Alpha","Celgene Corporation (CELG)",1,0,"http://seekingalpha.com/article/2277963-why-this-physician-is-bullish-on-celgene?source=feed",2014-07-28 17:57:05.816953
"Cisco For The Alpha Hunter - Cisco Systems, Inc. (NASDAQ:CSCO) | Seeking Alpha","Cisco Systems, Inc. (CSCO)",0,0,"http://seekingalpha.com/article/2278123-cisco-for-the-alpha-hunter?source=feed",2014-07-28 17:57:08.002863
"Tonix Approaching 100 Days Until BESTFIT Results - Tonix Pharmaceuticals Holding Corp. (NASDAQ:TNXP) | Seeking Alpha","Tonix Pharmaceuticals Holding Corp. (TNXP)",0,0,"http://seekingalpha.com/article/2278153-tonix-approaching-100-days-until-bestfit-results?source=feed",2014-07-28 17:57:10.336457
"American Airlines Group: A Strong Buy - American Airlines Group (NASDAQ:AAL) | Seeking Alpha","American Airlines Group (AAL)",1,1,"http://seekingalpha.com/article/2278203-american-airlines-group-a-strong-buy?source=feed",2014-07-28 17:57:13.727361
"Chicago Bridge And Iron - Speculative Buy - Chicago Bridge & Iron Company (NYSE:CBI) | Seeking Alpha","Chicago Bridge & Iron Company (CBI)",0,0,"http://seekingalpha.com/article/2278243-chicago-bridge-and-iron-speculative-buy?source=feed",2014-07-28 17:57:16.270614
"Intel: Valued Well For Alpha Hunters - Intel Corporation (NASDAQ:INTC) | Seeking Alpha","Intel Corporation (INTC)",0,0,"http://seekingalpha.com/article/2278263-intel-valued-well-for-alpha-hunters?source=feed",2014-07-28 17:57:18.517635
"Samsung Takes Aim At Google's Revenues - Samsung Electronics Co., Ltd. (OTCMKTS:SSNLF) | Seeking Alpha","Google Inc. (GOOG), GOOGL, SSNLF",0,0,"http://seekingalpha.com/article/2278323-samsung-takes-aim-at-googles-revenues?source=feed",2014-07-28 17:57:19.447256
"Silvercrest Asset Management: 46% Annual Growth Of Assets Under Management For Ten Years - Silvercrest Asset Management Group (NASDAQ:SAMG) | Seeking Alpha","Silvercrest Asset Management Group (SAMG)",0,0,"http://seekingalpha.com/article/2278413-silvercrest-asset-management-46-percent-annual-growth-of-assets-under-management-for-ten-years?source=feed",2014-07-28 17:57:20.251396
"Nordic American Offshore: High Dividend Yield And Strong Growth Prospects - Nordic American Offshore (NYSE:NAO) | Seeking Alpha","Nordic American Offshore (NAO)",0,0,"http://seekingalpha.com/article/2278463-nordic-american-offshore-high-dividend-yield-and-strong-growth-prospects?source=feed",2014-07-28 17:57:21.062665
"AbbVie - Attempt To Acquire Shire Is Driven By Opportunistic Tax Synergies - AbbVie Inc. (NYSE:ABBV) | Seeking Alpha","AbbVie Inc. (ABBV)",0,1,"http://seekingalpha.com/article/2278503-abbvie-attempt-to-acquire-shire-is-driven-by-opportunistic-tax-synergies?source=feed",2014-07-28 17:57:21.961420
"Lakes Entertainment: There's Hidden Value And Optionality - LAKES ENTERTAINMENT, INC. (NASDAQ:LACO) | Seeking Alpha","LAKES ENTERTAINMENT, INC. (LACO)",1,0,"http://seekingalpha.com/article/2278523-lakes-entertainment-theres-hidden-value-and-optionality?source=feed",2014-07-28 17:57:22.851390
"Oracle For The Alpha Hunter - Oracle Corporation (NYSE:ORCL) | Seeking Alpha","Oracle Corporation (ORCL)",0,0,"http://seekingalpha.com/article/2278533-oracle-for-the-alpha-hunter?source=feed",2014-07-28 17:57:24.462623
"Silver Wheaton: Destined To Double By 2015? It's Happened Before... - Silver Wheaton Corp. (NYSE:SLW) | Seeking Alpha","Silver Wheaton Corp. (SLW)",1,0,"http://seekingalpha.com/article/2278553-silver-wheaton-destined-to-double-by-2015-its-happened-before?source=feed",2014-07-28 17:57:26.203302
"Crashing Parties, Prolific Tweeting: Just Another Day In The Life For T-Mobile CEO - T-Mobile US, Inc. (NYSE:TMUS) | Seeking Alpha","T-Mobile US, Inc. (TMUS)",0,0,"http://seekingalpha.com/article/2278583-crashing-parties-prolific-tweeting-just-another-day-in-the-life-for-t-mobile-ceo?source=feed",2014-07-28 17:57:28.030820
"Trading Near Book Value And Primed For Growth With Recent Ownership Change, Schuff Is Very Attractive - Schuff International, Inc. (OTCMKTS:SHFK) | Seeking Alpha","Schuff International, Inc. (SHFK)",0,0,"http://seekingalpha.com/article/2278593-trading-near-book-value-and-primed-for-growth-with-recent-ownership-change-schuff-is-very-attractive?source=feed",2014-07-28 17:57:30.166951
"Microsoft For The Alpha Hunter - Microsoft Corporation (NASDAQ:MSFT) | Seeking Alpha","Microsoft Corporation (MSFT)",0,0,"http://seekingalpha.com/article/2278613-microsoft-for-the-alpha-hunter?source=feed",2014-07-28 17:57:32.532938
"In California, Car Charging Group Charges Ahead While NRG Energy Stumbles - Car Charging Group, Inc. (OTCMKTS:CCGI) | Seeking Alpha","Car Charging Group, Inc. (CCGI), NRG",0,0,"http://seekingalpha.com/article/2278663-in-california-car-charging-group-charges-ahead-while-nrg-energy-stumbles?source=feed",2014-07-28 17:57:34.828689
"Ambev: Bullish Or Bearish? - Ambev - Companhia de Bebidas das Americas (NYSE:ABEV) | Seeking Alpha","Ambev - Companhia de Bebidas das Americas (ABEV)",0,0,"http://seekingalpha.com/article/2278673-ambev-bullish-or-bearish?source=feed",2014-07-28 17:57:37.080944
"Buy Starbucks; UBS Is Right - Starbucks Corporation (NASDAQ:SBUX) | Seeking Alpha","Starbucks Corporation (SBUX)",0,0,"http://seekingalpha.com/article/2278683-buy-starbucks-ubs-is-right?source=feed",2014-07-28 17:57:39.350577
"Lightstream Resources - The Scale Of The Balance Sheet Makeover May Surprise The Market (In A Good Way) - Lightstream Resources Ltd. (OTCMKTS:LSTMF) | Seeking Alpha","Lightstream Resources Ltd. (LSTMF)",0,0,"http://seekingalpha.com/article/2278733-lightstream-resources-the-scale-of-the-balance-sheet-makeover-may-surprise-the-market-in-a-good-way?source=feed",2014-07-28 17:57:46.253048
"Grab Las Vegas Sands On Irrational Negative Sentiment - Las Vegas Sands Corp. (NYSE:LVS) | Seeking Alpha","Las Vegas Sands Corp. (LVS)",0,0,"http://seekingalpha.com/article/2278783-grab-las-vegas-sands-on-irrational-negative-sentiment?source=feed",2014-07-28 17:57:47.898968
"The 'Apple To Buy Tesla Motors' Question Settled - Apple Inc. (NASDAQ:AAPL) | Seeking Alpha","Apple Inc. (AAPL), TSLA",0,0,"http://seekingalpha.com/article/2278803-the-apple-to-buy-tesla-motors-question-settled?source=feed",2014-07-28 17:57:49.834746
"Imminent District Court Ruling Should Propel Zogenix Higher - Zogenix, Inc. (NASDAQ:ZGNX) | Seeking Alpha","Zogenix, Inc. (ZGNX)",0,0,"http://seekingalpha.com/article/2278823-imminent-district-court-ruling-should-propel-zogenix-higher?source=feed",2014-07-28 17:57:52.044790
"Is The Fire Phone Amazon's Leading Edge? - Amazon.com, Inc. (NASDAQ:AMZN) | Seeking Alpha","Amazon.com, Inc. (AMZN)",0,0,"http://seekingalpha.com/article/2278843-is-the-fire-phone-amazons-leading-edge?source=feed",2014-07-28 17:57:54.856319
"Same Stuff, Different Quarter: Oracle Is Attractive Again After An Earnings-Related Sell-Off - Oracle Corporation (NYSE:ORCL) | Seeking Alpha","Oracle Corporation (ORCL)",1,0,"http://seekingalpha.com/article/2278883-same-stuff-different-quarter-oracle-is-attractive-again-after-an-earnings-related-sell-off?source=feed",2014-07-28 17:57:57.261481
"3 Terrific Reasons To Invest In InvenSense - InvenSense (NYSE:INVN) | Seeking Alpha","InvenSense (INVN)",0,1,"http://seekingalpha.com/article/2278903-3-terrific-reasons-to-invest-in-invensense?source=feed",2014-07-28 17:57:58.982099
"Polski Koncern Naftowy - An Interesting Central European Play - Polski Koncern Nafto (OTCMKTS:PSKOF) | Seeking Alpha","Polski Koncern Nafto (PSKOF)",0,0,"http://seekingalpha.com/article/2278933-polski-koncern-naftowy-an-interesting-central-european-play?source=feed",2014-07-28 17:57:59.780104
"Alaska Communications: High Potential Rewards Justify The Risks - Alaska Communications Systems Group, Inc. (NASDAQ:ALSK) | Seeking Alpha","Alaska Communications Systems Group, Inc. (ALSK)",0,0,"http://seekingalpha.com/article/2278943-alaska-communications-high-potential-rewards-justify-the-risks?source=feed",2014-07-28 17:58:00.545271
"Energy Recovery's Bright Future - Discovers $2B/Year Monopoly, Updates Corporate Image - Energy Recovery, Inc. (NASDAQ:ERII) | Seeking Alpha","Energy Recovery, Inc. (ERII)",0,0,"http://seekingalpha.com/article/2278953-energy-recoverys-bright-future-discovers-2b-year-monopoly-updates-corporate-image?source=feed",2014-07-28 17:58:01.374790
"Eltek Ltd.: With Growth And Efficiency Improvements Just Ahead, This Could Be The Right Time To Buy Stock - Eltek Ltd. (NASDAQ:ELTK) | Seeking Alpha","Eltek Ltd. (ELTK)",1,0,"http://seekingalpha.com/article/2278983-eltek-ltd-with-growth-and-efficiency-improvements-just-ahead-this-could-be-the-right-time-to-buy-stock?source=feed",2014-07-28 17:58:02.496350
"Las Vegas Sands Should Continue To Rebound - Las Vegas Sands Corp. (NYSE:LVS) | Seeking Alpha","Las Vegas Sands Corp. (LVS)",0,0,"http://seekingalpha.com/article/2278993-las-vegas-sands-should-continue-to-rebound?source=feed",2014-07-28 17:58:03.972990
"Can Q2 Decrease In GPU Volume Affect AMD's Top And Bottom Line? - Advanced Micro Devices, Inc. (NYSE:AMD) | Seeking Alpha","Advanced Micro Devices, Inc. (AMD)",0,0,"http://seekingalpha.com/article/2279003-can-q2-decrease-in-gpu-volume-affect-amds-top-and-bottom-line?source=feed",2014-07-28 17:58:05.717052
"BlackBerry: Will Longs Be Laughing All The Way To The Bank? - BlackBerry Ltd. (NASDAQ:BBRY) | Seeking Alpha","BlackBerry Ltd. (BBRY)",0,0,"http://seekingalpha.com/article/2279033-blackberry-will-longs-be-laughing-all-the-way-to-the-bank?source=feed",2014-07-28 17:58:07.589475
"Support.com: An Undervalued Stock With Greater Than 50% Upside Potential - Support.com, Inc. (NASDAQ:SPRT) | Seeking Alpha","Support.com, Inc. (SPRT)",1,0,"http://seekingalpha.com/article/2279053-support-com-an-undervalued-stock-with-greater-than-50-percent-upside-potential?source=feed",2014-07-28 17:58:10.540180
"Korn Ferry Beats Estimates; Operating Leverage And Cash Pile Will Boost EPS - Korn/Ferry International (NYSE:KFY) | Seeking Alpha","Korn/Ferry International (KFY)",0,0,"http://seekingalpha.com/article/2279063-korn-ferry-beats-estimates-operating-leverage-and-cash-pile-will-boost-eps?source=feed",2014-07-28 17:58:12.102120
"The Tumor-Infiltrating Lymphocytes (TILs) And Cancer Therapy - Lion Biotechnologies, Inc. (OTCMKTS:LBIO) | Seeking Alpha","Lion Biotechnologies, Inc. (LBIO)",0,0,"http://seekingalpha.com/article/2279083-the-tumor-infiltrating-lymphocytes-tils-and-cancer-therapy?source=feed",2014-07-28 17:58:13.126569
"Generational Investing Opportunity: Randgold Resources - Randgold Resources Limited (NASDAQ:GOLD) | Seeking Alpha","Randgold Resources Limited (GOLD)",0,0,"http://seekingalpha.com/article/2279113-generational-investing-opportunity-randgold-resources?source=feed",2014-07-28 17:58:13.942335
"Athletic Momentum For Athlon? - Athlon Energy Inc. (NYSE:ATHL) | Seeking Alpha","Athlon Energy Inc. (ATHL)",0,0,"http://seekingalpha.com/article/2279173-athletic-momentum-for-athlon?source=feed",2014-07-28 17:58:14.750744
"A New Chapter For AIG - American International Group Inc (NYSE:AIG) | Seeking Alpha","American International Group Inc (AIG)",0,1,"http://seekingalpha.com/article/2279233-a-new-chapter-for-aig?source=feed",2014-07-28 17:58:16.262636
"GT Advanced Technologies: All Set To Benefit From Apple's iPhone 6 - GT Advanced Technologies, Inc. (NASDAQ:GTAT) | Seeking Alpha","GT Advanced Technologies, Inc. (GTAT)",0,0,"http://seekingalpha.com/article/2279293-gt-advanced-technologies-all-set-to-benefit-from-apples-iphone-6?source=feed",2014-07-28 17:58:17.876788
"Century Communities - Disappointing Debut Of Fast-Growing And Profitable Home-Builder Creates Opportunities - Century Communities, Inc. (NYSE:CCS) | Seeking Alpha","Century Communities, Inc. (CCS)",0,1,"http://seekingalpha.com/article/2279313-century-communities-disappointing-debut-of-fast-growing-and-profitable-home-builder-creates-opportunities?source=feed",2014-07-28 17:58:19.616772
"What Now For DryShips? - DryShips Inc. (NASDAQ:DRYS) | Seeking Alpha","DryShips Inc. (DRYS)",0,0,"http://seekingalpha.com/article/2279373-what-now-for-dryships?source=feed",2014-07-28 17:58:21.664899
"Sound Financial Bancorp: A Regional Bank That Is Charging Full Speed Ahead - Sound Financial Bancorp, Inc. (NASDAQ:SFBC) | Seeking Alpha","Sound Financial Bancorp, Inc. (SFBC)",0,0,"http://seekingalpha.com/article/2279383-sound-financial-bancorp-a-regional-bank-that-is-charging-full-speed-ahead?source=feed",2014-07-28 17:58:23.749836
"BlackBerry Continues To Be Our Turnaround Stock For 2014 - BlackBerry Ltd. (NASDAQ:BBRY) | Seeking Alpha","BlackBerry Ltd. (BBRY)",0,0,"http://seekingalpha.com/article/2279403-blackberry-continues-to-be-our-turnaround-stock-for-2014?source=feed",2014-07-28 17:58:26.046011
"MercadoLibre's Expanding Prowess - MercadoLibre, Inc. (NASDAQ:MELI) | Seeking Alpha","MercadoLibre, Inc. (MELI)",0,0,"http://seekingalpha.com/article/2279413-mercadolibres-expanding-prowess?source=feed",2014-07-28 17:58:28.310306
